{"run_id":"RUN-TEST","problem_id":"P","question_id":"Q","method_id":"M","git_commit":"0000000000000000000000000000000000000000","input_files":[],"input_hashes":{},"config":{},"random_seed":null,"environment":{},"command":["fixture"],"exit_code":0,"solver_status":"NOT_RUN","metrics":{},"outputs":[],"is_final":false,"supersedes":null,"reviewed_by":[]}
